{
  "schema_version": 1,
  "id": "example-attempt-001",
  "challenge_id": "capybara-hoverboard-v1",
  "series_id": "example-series-001",
  "attempt_number": 1,
  "provider": "Example provider",
  "model": {
    "display_name": "Example model",
    "identifier": "example-label",
    "identifier_kind": "display-only"
  },
  "generated_at": null,
  "generation": {
    "mode": "one-shot",
    "interface": "web-chat",
    "tools_used": "unknown"
  }
}
